<?xml version="1.0" encoding="UTF-8" standalone="no"?>
<SDSParameterImport xmlns:xsi="http://www.w3.org/2001/XMLSchema-instance"
	xsi:noNamespaceSchemaLocation="SDSParameter.xsd">
	<SDSParameter>
		<DashBoard>
			<DashboardRange>CURRENT_WEEK</DashboardRange>
		</DashBoard>
		<Order>
			<OrderSearch>
				<OrderSearchRange>CURRENT_QUARTER</OrderSearchRange>
				<OpenOrderSearchRange>CURRENT_QUARTER</OpenOrderSearchRange>
				<DeliveredOrderSearchRange>CURRENT_QUARTER</DeliveredOrderSearchRange>
				<CancelledOrderSearchRange>CURRENT_QUARTER</CancelledOrderSearchRange>
				<ReturnedOrderSearchRange>CURRENT_QUARTER</ReturnedOrderSearchRange>
				<SaveOrderSearchRange>CURRENT_QUARTER</SaveOrderSearchRange>
				<DataEntryRoleID>6</DataEntryRoleID>
				<SalesAgentRoleID>5</SalesAgentRoleID>
				<DivisionHeadRoleID>7</DivisionHeadRoleID>
			</OrderSearch>
			<BookOrder>
				<CheckForAvailableInventory>Yes</CheckForAvailableInventory>
				<EnableBookOrderManagerOverride>Yes</EnableBookOrderManagerOverride>
				<EnableRebateCustomerForExpiryItems>No</EnableRebateCustomerForExpiryItems>
				<DiscountPercentageLimit>0</DiscountPercentageLimit>
				<EnableDoubleDiscounts>Yes</EnableDoubleDiscounts>
				<EnableExceedingCustomerAvailableLimit>No</EnableExceedingCustomerAvailableLimit>
				<OrderExpiryDays>30</OrderExpiryDays>
				<ScheduledDeliveryOrderBeforeNoOfDays>7</ScheduledDeliveryOrderBeforeNoOfDays>
				<EnableSendingMailToCustomer>Yes</EnableSendingMailToCustomer>
				<EnableSendingMailToDeptHead>Yes</EnableSendingMailToDeptHead>
				<EnableSendingMailToSalesAgent>Yes</EnableSendingMailToSalesAgent>
				<EnableSendingMailToDataEntryOperator>Yes</EnableSendingMailToDataEntryOperator>
				<EnableGroupingDiscountedLineItems>No</EnableGroupingDiscountedLineItems>
				<InceaseAvailLimitPercenatageForSegmentA>0</InceaseAvailLimitPercenatageForSegmentA>
				<InceaseAvailLimitPercenatageForSegmentB>0</InceaseAvailLimitPercenatageForSegmentB>
				<InceaseAvailLimitPercenatageForSegmentC>0</InceaseAvailLimitPercenatageForSegmentC>
			</BookOrder>
		</Order>
		<Invoice>
			<InvoiceSearch>
				<InvoiceSearchRange>CURRENT_QUARTER</InvoiceSearchRange>
				<OpenInvoiceRange>CURRENT_QUARTER</OpenInvoiceRange>
				<EnableSDSOfflineInvoice>Yes</EnableSDSOfflineInvoice>
				<OfflineInvoiceGenerationTimeInMinutes>30</OfflineInvoiceGenerationTimeInMinutes>
				<EnableInvoiceCancellation>Yes</EnableInvoiceCancellation>
				<EnableMarkAsDeliveredForOfflineInvoice>Yes</EnableMarkAsDeliveredForOfflineInvoice>
				<EnableSendingMailToCustomer>Yes</EnableSendingMailToCustomer>
				<EnableSendingMailToDeptHead>Yes</EnableSendingMailToDeptHead>
				<EnableSendingMailToSalesAgent>Yes</EnableSendingMailToSalesAgent>
				<EnableSendingMailToDataEntryOperator>Yes</EnableSendingMailToDataEntryOperator>
				<EnableRecordPaymentButton>Yes</EnableRecordPaymentButton>
			</InvoiceSearch>
		</Invoice>
		<Payment>
			<PaymentSearch>
				<PaymentSearchRange>CURRENT_QUARTER</PaymentSearchRange>
			</PaymentSearch>
			<PaymentMethod>
				<EnablePaymentMethodCash>Yes</EnablePaymentMethodCash>
				<EnablePaymentmethodCheque>No</EnablePaymentmethodCheque>
				<EnablePaymentmethodVoucher>No</EnablePaymentmethodVoucher>
				<EnablePaymentmethodCoupon>No</EnablePaymentmethodCoupon>
				<EnableSendingMailToCustomer>No</EnableSendingMailToCustomer>
				<EnableSendingMailToDeptHead>No</EnableSendingMailToDeptHead>
				<EnableSendingMailToSalesAgent>No</EnableSendingMailToSalesAgent>
				<EnableSendingMailToDataEntryOperator>Yes</EnableSendingMailToDataEntryOperator>
			</PaymentMethod>
		</Payment>
		<Claim>
			<ClaimSearch>
				<ClaimSearchRange>CURRENT_QUARTER</ClaimSearchRange>
				<ApproveClaimSearchRange>CURRENT_QUARTER</ApproveClaimSearchRange>
				<ClaimNeedToBeAcceptedRange>CURRENT_QUARTER</ClaimNeedToBeAcceptedRange>
				<ClaimAutoAcceptedRange>CURRENT_QUARTER</ClaimAutoAcceptedRange>
				<RejectedClaimRange>CURRENT_QUARTER</RejectedClaimRange>
			</ClaimSearch>
			<RegisterClaim>
				<EnableClaimWithOutInvoice>No</EnableClaimWithOutInvoice>
				<EnableRegisterClaimManagerOveride>Yes</EnableRegisterClaimManagerOveride>
				<EnableSendingMailToCustomer>Yes</EnableSendingMailToCustomer>
				<EnableSendingMailToDeptHead>Yes</EnableSendingMailToDeptHead>
				<EnableSendingMailToSalesAgent>Yes</EnableSendingMailToSalesAgent>
				<EnableSendingMailToDataEntryOperator>Yes</EnableSendingMailToDataEntryOperator>
			</RegisterClaim>
			<ApproveClaim>
				<EnableSendingMailToCustomer>Yes</EnableSendingMailToCustomer>
				<EnableSendingMailToDeptHead>Yes</EnableSendingMailToDeptHead>
				<EnableSendingMailToSalesAgent>Yes</EnableSendingMailToSalesAgent>
				<EnableSendingMailToDataEntryOperator>Yes</EnableSendingMailToDataEntryOperator>
			</ApproveClaim>
			<AcceptClaim>
				<EnableAutoAcceptClaim>Yes</EnableAutoAcceptClaim>
				<EnableSendingMailToCustomer>Yes</EnableSendingMailToCustomer>
				<EnableSendingMailToDeptHead>Yes</EnableSendingMailToDeptHead>
				<EnableSendingMailToSalesAgent>Yes</EnableSendingMailToSalesAgent>
				<EnableSendingMailToDataEntryOperator>Yes</EnableSendingMailToDataEntryOperator>
			</AcceptClaim>
		</Claim>
		<Customer>
			<CustomerSearch>
				<CustomerNoOfOpenOrderDisplay>5</CustomerNoOfOpenOrderDisplay>
				<CustomerNoOfReceiptDisplay>5</CustomerNoOfReceiptDisplay>
				<CustomerNoOfCreditNoteDisplay>5</CustomerNoOfCreditNoteDisplay>
				<CustomerNoOfOpenInvoiceDisplay>5</CustomerNoOfOpenInvoiceDisplay>
			</CustomerSearch>
		</Customer>
		<Notification>
			<InventoryNotification>
				<EnableLowInventoryNotification>Yes</EnableLowInventoryNotification>
				<LowInventoryNotificationThreshold>0</LowInventoryNotificationThreshold>
				<LowInventoryNotificationEmail>lalit.kanreki@salams.com</LowInventoryNotificationEmail>
			</InventoryNotification>
			<NewInvoiceNotification>
				<EnableNewInvoiceNotification>Yes</EnableNewInvoiceNotification>
				<NewInvoiceNotificationRange>CURRENT_WEEK</NewInvoiceNotificationRange>
			</NewInvoiceNotification>
		</Notification>
	</SDSParameter>
</SDSParameterImport>